{
  "schema_version": "1.0",
  "job_id": "scan-job-demo-001",
  "tenant_id": "tenant-demo",
  "asset_id": "asset-web-001",
  "requested_by": "analyst-demo",
  "target_url": "https://staging.example.com/products",
  "profile": "web_baseline",
  "idempotency_key": "demo-scan-job-key-01",
  "request_fingerprint": "0123456789abcdef0123456789abcdef0123456789abcdef0123456789abcdef",
  "status": "queued",
  "created_at": "2026-10-22T10:00:00Z",
  "updated_at": "2026-10-22T10:00:00Z",
  "attempt": 0,
  "lease_id": null,
  "lease_expires_at": null,
  "last_reason_code": null
}
